ID,TITLE,CONTENT,VISUAL
1,"Word, Neon-Wired: Turbocharge Your Docs Like a Cyberpunk Pro","Turn boring Word tasks into a neon-lit sprint with ruthless templates, sassy styles, and auto-formatting that reads your mind.","A digital vector illustration of a confident, edgy woman stationed inside a chrome Holo-desk, her eyes glinting emerald as she flicks a fingertip and a luminous Word document materialises, edits buzzing around it like satellites, rainbow neon hair snapping in the airflow, circuit trails spiralling up her sleeves, keyboard keys hovering like drones, and a city of holographic data billboards flashing in the background; captured in crisp vector style with bold colour blocks and restrained glow, exuding boss-level command."
2,"Macros, Mayhem & Microsoft Word: The Diva’s Auto-Itinerary","Slice through mundane formatting with sassy macros and a daredevil approach to automation that even the printers fear.","A sleek cyberpunk office pod where the Digital Diva commands a holographic ribbon of macros dancing across the air, her cape of code fluttering as a glowing Word macro pops open a document template with a single wink, diverse avatars orbiting like tiny AI satellites, neon strings weaving through the air as if conducting an orchestra of productivity."
3,"Templates That Actually Save You Time (Yes, Seriously)","Turn templates into time machines—no more staring at a blank page, ever again.","Inside a glass-walled cowork pod, the Diva taps a template library that sprouts directly into a pristine document; fonts glow like neon runes, placeholders float in mid-air awaiting fill, and a tiny hoverboard of productivity zips around the desk delivering perfect structure in every paragraph."
4,"Collaboration Without Chaos: Word in the Age of Uplink","Make co-editing feel like a playlist, not a brawl, with real-time vibes and tidy version control.","Two avatars share a Word doc inside a shimmering holo-canvas, the Diva smoothing out edits with a flick, cursors weaving like neon threads, and a skyline of teammates’ avatars orbiting the document as comments cascade down like digital rain."
5,"Distraction-Proof Docs: The Art of Focused Word","Slash your context-switching with ruthless document architecture and ruthless but friendly borders.","A dimly lit cube of concentration where the Diva defines clean sections with glowing section breaks, a horizon of distraction-proof margins, and a stern timer ticking down in electric blue as the document stays pristine and-focused."
6,"Powerful Styles, Pedantic People-Be-Tendencies","Make typography your secret weapon without becoming a dictator of fonts.","The Diva stands atop a column of type scales, commands a spectrum of styles from headings to captions with a wave of her hand, while the Word document below blooms with consistent, sharp typography that exudes professional swagger."
7,"Footnotes, Endnotes & the Cybernetic Soul of Word","Make the tiny, often overlooked bits count with flair and precision.","A neon-lit alley of footnotes and endnotes, the Diva orchestrates references like constellations, tiny superscripts orbiting a central claim as the document breathes with scholarly swagger."
8,"Charts That Don’t Suck: Word’s Hidden Power for Data Nerds","Turn bland data into dazzling, dashboard-level visuals without leaving Word.","A dashboard orchestra within Word where data points burst into neon ribbons and the Diva conducts a chorus of charts, each chart tile a glowing glyph, transforming numbers into a street-level story."
9,"Smart Lists, Daring Bullets & the Art of Control","Bullet lists that behave—no more rogue indentations, ever.","The Diva strides along a conveyor belt of bullets that align themselves to perfection, each indentation snapping into place as if guided by a neon compass, while the document hums with ordered rebellion."
10,"Accessibility as Attitude: Word for Everyone, Everywhere","Make inclusive docs that look badass and work for all users, no apologise accepted."
...[truncated]